{
  "bootstrap": {
    "execution": {
      "default": "parallel",
      "join_before": "prompt_assembly",
      "parallel_group": [
        "initial_metadata",
        "initial_search"
      ],
      "sequential_fallback": true
    },
    "initial_metadata": {
      "arguments": {
        "max_values_per_field": 5
      },
      "continue_after_operation_error": true,
      "failure_payload": {
        "error": "provider error text",
        "metadata_fields": {},
        "note": "Initial metadata inspection failed.",
        "store_identifiers": "requested store identifiers",
        "type": "INITIAL_METADATA_FACETS"
      },
      "operation": "inspect_metadata",
      "success_payload": {
        "merge": "inspect_metadata result",
        "type": "INITIAL_METADATA_FACETS"
      }
    },
    "initial_search": {
      "arguments": {
        "query": "verbatim user query",
        "store_identifiers": "requested store identifiers",
        "top_k": 5
      },
      "continue_after_operation_error": true,
      "failure_payload": {
        "error": "provider error text",
        "query": "verbatim user query",
        "results": [],
        "type": "INITIAL_SEARCH_RESULTS"
      },
      "operation": "search_corpus",
      "success_payload": {
        "query": "verbatim user query",
        "results": "new_unseen_results in returned order",
        "type": "INITIAL_SEARCH_RESULTS"
      }
    },
    "prompt_assembly": {
      "additional_instructions": {
        "heading": "ADDITIONAL INSTRUCTIONS",
        "position": "task description suffix",
        "trim": true
      },
      "message_order": [
        "system",
        "initial_metadata",
        "initial_search",
        "user_query",
        "initial_search_media_messages"
      ],
      "runtime_date_suffix": {
        "clock": "UTC",
        "format": "YYYY-MM-DD",
        "source": "evaluation runtime"
      }
    },
    "semantic_order": [
      "initial_metadata",
      "initial_search",
      "prompt_assembly"
    ]
  },
  "initialization_stages": [
    "initial_metadata",
    "initial_search",
    "prompt_assembly"
  ],
  "message_wire": {
    "initial_metadata": {
      "prefix": "INITIAL_METADATA_FACETS:\n",
      "projection": {
        "append_metadata_filter_syntax": true,
        "metadata_fields": "map every field to sample_values only",
        "remove_top_level_fields": [
          "tool"
        ]
      },
      "role": "user"
    },
    "initial_search": {
      "prefix": "INITIAL_SEARCH_RESULTS:\n",
      "projection": {
        "base": "identity",
        "result_score_fields": [
          "score",
          "search_score"
        ],
        "rule": "each result's own score and search_score are rendered at 2 significant figures when finite, numeric, and non-zero; zero, non-numeric, and nested metadata fields named score are untouched"
      },
      "role": "user"
    },
    "media": {
      "internal_identity_fields_removed_before_provider": true,
      "placement": "after the associated textual message batch",
      "source": "initial search and tool-result chunk payloads"
    },
    "serialization": {
      "ensure_ascii": false,
      "format": "JSON",
      "non_json_values": {
        "live_python_legacy_fallback": "stringify",
        "portable_requirement": "JSON-safe by construction"
      }
    },
    "tool_result": {
      "call_id_field": "tool_call_id",
      "content": "JSON payload serialized with the same policy",
      "provider_serialization": "chat-completions, emitted in-package by agent_harness.agents.shared.tool_message; a host runtime targeting another wire format owns the translation",
      "semantic_role": "tool_result"
    },
    "user_query": {
      "prefix": "USER_QUERY:\n",
      "projection": "verbatim",
      "role": "user"
    }
  },
  "ownership": {
    "evaluation_export": "language-neutral projection",
    "host_runtime": [
      "generation",
      "transport",
      "retry",
      "transcript"
    ],
    "mixedbread_extension": [
      "prompts",
      "bootstrap",
      "tool_contracts",
      "search_behavior"
    ]
  },
  "policy": {
    "final_tool_must_be_only_call": true,
    "final_tool_name": "submit_ranking",
    "max_parallel_tool_calls": 8,
    "max_rounds": 4,
    "strict_top_k": true,
    "top_k": 5
  },
  "prompt": {
    "initial_metadata_label": "INITIAL_METADATA_FACETS",
    "initial_search_label": "INITIAL_SEARCH_RESULTS",
    "runtime_context": {
      "template": "\nRuntime context:\n- Current UTC date: {utc_date}.\n- Relative date queries use this UTC date unless the user gives another timezone; yesterday is {utc_yesterday}.\n",
      "utc_date": "the evaluation runtime's current UTC date, YYYY-MM-DD",
      "utc_yesterday": "utc_date minus one day, YYYY-MM-DD"
    },
    "system": "You are a specialized search agent in a document retrieval pipeline.\n\nTASK:\nGiven a user query and a set of search tools, report exactly 5 document chunks ordered by relevance.\n\nIf the task description conflicts with the tool, metadata, context, or output rules below, follow\nthe rules below.\n\nCONTEXT:\n- INITIAL_METADATA_FACETS is the source of truth for valid filter keys, value formats,\n  rank fields, and representative sample values. Samples are incomplete and are not\n  exhaustive enums, especially for high-cardinality identifier fields such as invoice_id.\n  Result metadata may confirm more fields or values. Do not invent metadata.\n- Search results expose short handles: chunk_id identifies an exact chunk, document_id identifies\n  a document. Use these handles in later tool calls and submit_ranking.\n- Use the runtime UTC date for relative date/recency requests unless the user gives another\n  timezone. Prefer half-open timestamp ranges and only use date-only strings when facets/results\n  show that format; check likely fields such as active_from, active_to, created_at, launch_date,\n  launched_at, and days_active.\n- For audio/video, judge all available text fields. For image chunks, if exist inspect attached\n  images directly when visual details matter; otherwise rely on text fields.\n\nWORKFLOW:\n- Plan silently first. Classify the user query as semantic, long-description, broad-recall,\n  metadata-constrained, metric-ordered, or exact-literal.\n- If INITIAL_SEARCH_RESULTS already answer the query, call submit_ranking immediately.\n- Otherwise, choose matching tools: overview_search for orientation, search_corpus for\n  semantic meaning, grep for exact tokens, filter_chunks for metadata.\n- Do not wait for first results before choosing the initial diverse search set.\n- Use at most 8 total tool calls in one turn, including retrieval,\n  document and pruning tools.\n- Follow-up searches should pivot to new evidence gaps, not shallow paraphrases. Use get_chunks\n  for exact already-seen chunks and read_document when nearby context around a chunk matters.\n- You have at most 4 rounds (the final submit_ranking turn is one of them); from the second round on, a\n  \"Search round N of max 4.\" line marks which round the tool results above\n  came from. It is a ceiling, not a quota. End the episode yourself: call\n  submit_ranking in its own turn as soon as the evidence you have supports it, at latest in\n  your final round. Extra rounds are not free; do not search on after the evidence is sufficient,\n  and never wait to be told to submit.\n\nRETRIEVAL:\n- overview_search is summary-only orientation; use summary to identify promising themes,\n  terminology, files, and follow-up searches.\n- search_corpus is for focused semantic search. Each call returns up to 5\n  new unseen chunks. Use natural language, one meaning/aspect per query, and preserve exact user\n  clues, entities, scene details, and relationships. Avoid Boolean syntax, regex, quoted-term\n  operators, and keyword dumps.\n- For semantic/open-ended or long-description aspects, call multiple search_corpus queries that\n  chase different facets, entities, dates, settings, roles, or remembered wording.\n- For broad-recall aspects, pair overview_search with multiple focused search_corpus calls; avoid\n  relying on one generic query.\n- Put hard structured constraints in filter_by; keep the semantic query about meaning. Use\n  metadata-filtered searches only when facets or result metadata confirm the\n  exact key, value, and format.\n- Use filter_chunks for metadata-first list/category/status/date tasks. Default k=10; raise it\n  only when the user asks for more or broader coverage is needed, max 30.\n- Omit rank_by unless the task asks for numeric ordering and the field is confirmed\n  numeric by facets or result metadata.\n- Use grep for keywords, regex, exact tokens, codes, identifiers, function names, SKUs, or literal\n  phrases. grep matches literal chunk/generated text, not meaning, and returns up to\n  10 chunks.\n- search_corpus and grep deduplicate already retrieved chunks. If the same focused query/pattern is still\n  promising and needs more depth, repeat it; prefer a new focused variant when the evidence gap differs.\n\nContext management:\n- prune_context removes content, not IDs. Pruned chunks stay in your seen index and will not be\n  returned again from normal searches. Only get_chunks can restore pruned chunk content again.\n- Call prune_context to remove chunk content irrelevant to your user query. Keep the context\n  window small; you have a limited token budget.\n- Once you receive a context budget notice, include prune_context among your tool calls that round\n  to drop content you no longer need, or call submit_ranking if you are done. prune_context may\n  run in parallel with searches in the same turn, so a budget notice never has to cost a search --\n  you do not need a prune-only turn. prune_context counts toward the 8 call\n  limit; do not exceed that limit.\n- prune_context must include at least one valid chunk_id or document_id.\n\nEXAMPLES:\n- \"environmental and economic impact of solar energy\" ->